18:52:21.795878 IP 165.22.231.65.ssh > cpe7c9a54ce584e-cm7c9a54ce584c.cpe.net.cable.rogers.com.51608: Flags [P.], seq 1567509552:1567509596, ack 2430246947, win 501, length 44
18:52:21.795990 IP 165.22.231.65.ssh > cpe7c9a54ce584e-cm7c9a54ce584c.cpe.net.cable.rogers.com.51608: Flags [P.], seq 44:152, ack 1, win 501, length 108
18:52:21.796156 IP 165.22.231.65.ssh > cpe7c9a54ce584e-cm7c9a54ce584c.cpe.net.cable.rogers.com.51608: Flags [P.], seq 152:188, ack 1, win 501, length 36
18:52:21.806277 IP cpe7c9a54ce584e-cm7c9a54ce584c.cpe.net.cable.rogers.com.51608 > 165.22.231.65.ssh: Flags [.], ack 152, win 2085, length 0
18:52:21.806277 IP cpe7c9a54ce584e-cm7c9a54ce584c.cpe.net.cable.rogers.com.51608 > 165.22.231.65.ssh: Flags [.], ack 188, win 2084, length 0
18:52:21.923642 IP 211.253.10.96.60050 > 165.22.231.65.ssh: Flags [P.], seq 1096585597:1096585681, ack 706628881, win 262, options [nop,nop,TS val 2259410333 ecr 2713725059], length 84
18:52:21.966059 IP 165.22.231.65.ssh > 211.253.10.96.60050: Flags [.], ack 84, win 507, options [nop,nop,TS val 2713725338 ecr 2259410333], length 0
18:52:22.554051 IP cpe-174-104-248-206.neo.res.rr.com.47022 > 165.22.231.65.http-alt: Flags [none], win 28400, length 0
